{
 "version": "block-2",
 "positions": [
  {
   "id": "standing_neutral",
   "domain": "standing",
   "range": "kick",
   "posture": "standing",
   "dominant_side_role": "neutral",
   "allowed_techniques": [
    "ankle_pick",
    "armada",
    "au",
    "axe_kick",
    "bencao",
    "bob_weave",
    "body_hook",
    "body_jab",
    "body_kick",
    "body_lock",
    "body_straight_punch",
    "bong_sao",
    "bounce_step",
    "brawler_straight",
    "bridge_smash",
    "brush_knee_palm",
    "cage_plum",
    "calf_kick",
    "cartwheel_kick",
    "chain_punch",
    "check",
    "check_hook",
    "circle_walk",
    "clinch_break",
    "collar_tie",
    "cross",
    "cut_kick",
    "cut_off_step",
    "deflect_parry_punch",
    "double_leg",
    "double_roundhouse",
    "esquiva",
    "evade_step_back",
    "fa_jin_push",
    "fast_roundhouse",
    "feint",
    "finger_jab",
    "flying_knee",
    "flying_side_kick",
    "foot_sweep",
    "front_kick",
    "ginga",
    "guard_pull",
    "haymaker",
    "head_kick",
    "headbutt",
    "hook",
    "horizontal_elbow",
    "instep_head_kick",
    "iron_mountain_lean",
    "jab",
    "jam_step",
    "jumping_back_kick",
    "jumping_knee",
    "jumping_switch_kick",
    "kick_catch",
    "kick_into_throw",
    "lap_sao",
    "lead_straight_intercept",
    "lead_uppercut",
    "lean_back",
    "low_kick",
    "lunging_headbutt",
    "martelo",
    "meia_lua_de_compasso",
    "negativa",
    "no_shadow_kick",
    "oblique_kick",
    "overhand",
    "pak_sao",
    "parry",
    "piercing_palm",
    "pivot",
    "pull_counter",
    "pummel",
    "push_hands_redirect",
    "queixada",
    "question_mark_kick",
    "quick_grip_throw",
    "rasteira",
    "rear_body_hook",
    "rear_hook",
    "retreat",
    "shell_block",
    "shield_counter_hook",
    "shield_frame",
    "short_uppercut",
    "shoulder_roll",
    "shove",
    "shovel_hook",
    "side_kick",
    "single_leg",
    "single_palm_change",
    "slip",
    "spinning_back_kick",
    "spinning_backfist",
    "spinning_elbow",
    "spinning_hook_kick",
    "sprawl",
    "step",
    "stomp_thrust_punch",
    "straight_knee",
    "superman_punch",
    "switch_kick",
    "switch_step",
    "tan_sao",
    "teep",
    "tiger_claw",
    "top_elbow",
    "tornado_kick",
    "turning_throw",
    "underhook",
    "uppercut",
    "uppercut_elbow",
    "wall_run_kick",
    "wall_tie",
    "whizzer",
    "wild_hook"
   ],
   "roles": [
    "neutral",
    "neutral"
   ],
   "control_value_per_second": {
    "neutral": 0.0
   },
   "status": "existing"
  },
  {
   "id": "caught_single_leg",
   "domain": "standing",
   "range": "close",
   "posture": "standing",
   "dominant_side_role": "initiator",
   "allowed_techniques": [
    "caught_kick_dump",
    "clinch_break",
    "cross",
    "outside_trip",
    "sanda_sweep",
    "single_leg"
   ],
   "roles": [
    "holder",
    "held"
   ],
   "control_value_per_second": {
    "holder": 0.4,
    "held": 0.0
   },
   "status": "existing"
  },
  {
   "id": "standing_back_take",
   "domain": "standing",
   "range": "clinch",
   "posture": "standing",
   "dominant_side_role": "back_controller",
   "allowed_techniques": [
    "ankle_pick",
    "body_lock",
    "body_lock_takedown",
    "cage_plum",
    "clinch_break",
    "clinch_headbutt",
    "collar_tie",
    "fa_jin_push",
    "foot_sweep",
    "guard_pull",
    "headbutt",
    "horizontal_elbow",
    "inside_trip",
    "iron_mountain_lean",
    "kick_into_throw",
    "knee_body",
    "knee_head_clinch",
    "outside_trip",
    "pummel",
    "push_hands_redirect",
    "quick_grip_throw",
    "retreat",
    "shield_frame",
    "short_uppercut",
    "shove",
    "shovel_hook",
    "sprawl",
    "step",
    "submission_escape",
    "suplex",
    "take_back",
    "top_elbow",
    "turning_throw",
    "underhook",
    "uppercut_elbow",
    "wall_tie",
    "whizzer"
   ],
   "roles": [
    "back_controller",
    "controlled"
   ],
   "control_value_per_second": {
    "back_controller": 0.6,
    "controlled": 0.0
   },
   "status": "existing"
  },
  {
   "id": "collar_tie",
   "domain": "clinch",
   "range": "clinch",
   "posture": "standing",
   "dominant_side_role": "initiator",
   "allowed_techniques": [
    "ankle_pick",
    "body_lock",
    "cage_plum",
    "clinch_break",
    "clinch_headbutt",
    "collar_tie",
    "double_collar_tie",
    "fa_jin_push",
    "foot_sweep",
    "guard_pull",
    "headbutt",
    "hip_throw",
    "hook",
    "horizontal_elbow",
    "inside_trip",
    "iron_mountain_lean",
    "kick_into_throw",
    "knee_body",
    "knee_head_clinch",
    "outside_trip",
    "pummel",
    "push_hands_redirect",
    "quick_grip_throw",
    "retreat",
    "shield_frame",
    "short_uppercut",
    "shove",
    "shovel_hook",
    "snap_down",
    "sprawl",
    "step",
    "submission_escape",
    "top_elbow",
    "turning_throw",
    "underhook",
    "uppercut",
    "uppercut_elbow",
    "wall_tie",
    "whizzer"
   ],
   "roles": [
    "tier",
    "tied"
   ],
   "control_value_per_second": {
    "tier": 0.3,
    "tied": 0.0
   },
   "status": "existing"
  },
  {
   "id": "thai_plum",
   "domain": "clinch",
   "range": "clinch",
   "posture": "standing",
   "dominant_side_role": "initiator",
   "allowed_techniques": [
    "ankle_pick",
    "body_lock",
    "cage_plum",
    "clinch_break",
    "clinch_headbutt",
    "collar_tie",
    "fa_jin_push",
    "foot_sweep",
    "guard_pull",
    "headbutt",
    "horizontal_elbow",
    "inside_trip",
    "iron_mountain_lean",
    "jumping_knee",
    "kick_into_throw",
    "knee_body",
    "knee_head_clinch",
    "outside_trip",
    "pummel",
    "push_hands_redirect",
    "quick_grip_throw",
    "retreat",
    "shield_frame",
    "short_uppercut",
    "shove",
    "shovel_hook",
    "sprawl",
    "step",
    "submission_escape",
    "top_elbow",
    "turning_throw",
    "underhook",
    "uppercut_elbow",
    "wall_tie",
    "whizzer"
   ],
   "roles": [
    "plum_holder",
    "plummed"
   ],
   "control_value_per_second": {
    "plum_holder": 0.5,
    "plummed": 0.0
   },
   "status": "existing"
  },
  {
   "id": "over_under",
   "domain": "clinch",
   "range": "clinch",
   "posture": "standing",
   "dominant_side_role": "neutral",
   "allowed_techniques": [
    "ankle_pick",
    "body_lock",
    "cage_plum",
    "clinch_break",
    "clinch_headbutt",
    "collar_tie",
    "fa_jin_push",
    "foot_sweep",
    "guard_pull",
    "headbutt",
    "hip_throw",
    "horizontal_elbow",
    "inside_trip",
    "iron_mountain_lean",
    "kick_into_throw",
    "knee_body",
    "knee_head_clinch",
    "outside_trip",
    "pummel",
    "push_hands_redirect",
    "quick_grip_throw",
    "retreat",
    "shield_frame",
    "short_uppercut",
    "shove",
    "shovel_hook",
    "sprawl",
    "step",
    "submission_escape",
    "top_elbow",
    "turning_throw",
    "underhook",
    "uppercut_elbow",
    "wall_tie",
    "whizzer"
   ],
   "roles": [
    "neutral",
    "neutral"
   ],
   "control_value_per_second": {
    "neutral": 0.0
   },
   "status": "existing"
  },
  {
   "id": "double_underhooks",
   "domain": "clinch",
   "range": "clinch",
   "posture": "standing",
   "dominant_side_role": "initiator",
   "allowed_techniques": [
    "ankle_pick",
    "body_lock",
    "cage_plum",
    "clinch_break",
    "clinch_headbutt",
    "collar_tie",
    "double_leg",
    "fa_jin_push",
    "foot_sweep",
    "guard_pull",
    "headbutt",
    "horizontal_elbow",
    "inside_trip",
    "iron_mountain_lean",
    "kick_into_throw",
    "knee_body",
    "knee_head_clinch",
    "outside_trip",
    "pummel",
    "push_hands_redirect",
    "quick_grip_throw",
    "retreat",
    "shield_frame",
    "short_uppercut",
    "shove",
    "shovel_hook",
    "sprawl",
    "step",
    "submission_escape",
    "top_elbow",
    "turning_throw",
    "underhook",
    "uppercut_elbow",
    "wall_tie",
    "whizzer"
   ],
   "roles": [
    "dominant",
    "controlled"
   ],
   "control_value_per_second": {
    "dominant": 0.5,
    "controlled": 0.0
   },
   "status": "existing"
  },
  {
   "id": "front_body_lock",
   "domain": "clinch",
   "range": "clinch",
   "posture": "standing",
   "dominant_side_role": "initiator",
   "allowed_techniques": [
    "ankle_pick",
    "body_lock",
    "body_lock_takedown",
    "cage_plum",
    "clinch_break",
    "clinch_headbutt",
    "collar_tie",
    "double_leg",
    "fa_jin_push",
    "foot_sweep",
    "guard_pull",
    "headbutt",
    "hip_throw",
    "horizontal_elbow",
    "inside_trip",
    "iron_mountain_lean",
    "kick_into_throw",
    "knee_body",
    "knee_head_clinch",
    "outside_trip",
    "pummel",
    "push_hands_redirect",
    "quick_grip_throw",
    "retreat",
    "shield_frame",
    "short_uppercut",
    "shove",
    "shovel_hook",
    "sprawl",
    "step",
    "submission_escape",
    "suplex",
    "take_back",
    "top_elbow",
    "turning_throw",
    "underhook",
    "uppercut_elbow",
    "wall_tie",
    "whizzer"
   ],
   "roles": [
    "locker",
    "locked"
   ],
   "control_value_per_second": {
    "locker": 0.5,
    "locked": 0.0
   },
   "status": "existing"
  },
  {
   "id": "wall_pinned",
   "domain": "clinch",
   "range": "clinch",
   "posture": "standing",
   "dominant_side_role": "initiator",
   "allowed_techniques": [
    "ankle_pick",
    "body_hook",
    "body_lock",
    "body_lock_takedown",
    "cage_plum",
    "clinch_break",
    "clinch_headbutt",
    "collar_tie",
    "double_leg",
    "fa_jin_push",
    "foot_sweep",
    "guard_pull",
    "headbutt",
    "horizontal_elbow",
    "inside_trip",
    "iron_mountain_lean",
    "kick_into_throw",
    "knee_body",
    "knee_head_clinch",
    "outside_trip",
    "pummel",
    "push_hands_redirect",
    "quick_grip_throw",
    "retreat",
    "shield_frame",
    "short_uppercut",
    "shove",
    "shovel_hook",
    "sprawl",
    "step",
    "submission_escape",
    "top_elbow",
    "turning_throw",